{
  "$schema": "http://json-schema.org/draft-07/schema#",
  "title": "QA_MAPPING_PROTOCOL_REF.v1",
  "type": "object",
  "required": ["protocol_version", "ref_path", "ref_sha256"],
  "properties": {
    "protocol_version": { "type": "string", "const": "QA_MAPPING_PROTOCOL_REF.v1" },
    "ref_path": { "type": "string", "minLength": 1 },
    "ref_sha256": { "type": "string", "pattern": "^[a-f0-9]{64}$" },
    "scope_note": { "type": "string" }
  },
  "additionalProperties": false
}
