{
  "protocol_version": "QA_MAPPING_PROTOCOL_REF.v1",
  "ref_path": "qa_mapping_protocol/canonical_mapping_protocol.json",
  "ref_sha256": "e0e586f537485cf530849493e05db1b64877e918140253f0e295953fe4dfe65d",
  "scope_note": "QA Septenary Cert family [150]: certifies {1,2,4,5,7,8}=(Z/9Z)* as the mod-9 unit group generated by doubling (period 6=phi(9)); complement {0,3,6}=singularity set; diagonal pairs sum to 9; parity cross-over. Source: Iverson QA mod-9 orbit + Grant/Ghannam Philomath Ch 1 doubling cycle."
}
