{
  "protocol_version": "QA_MAPPING_PROTOCOL_REF.v1",
  "ref_path": "qa_mapping_protocol/canonical_mapping_protocol.json",
  "ref_sha256": "e0e586f537485cf530849493e05db1b64877e918140253f0e295953fe4dfe65d",
  "scope_note": "QA Orbit Prime Ideal Filtration cert [385]. Primary sources: Nikolaev (2024) 'Quantum arithmetic' doi.org/10.48550/arXiv.2412.09148 (Lemma 3.3: eventually periodic Bratteli diagram iff real multiplication on Serre C*-algebra); Wall (1960) Fibonacci primitive roots and the period of the Fibonacci sequence modulo a prime, American Mathematical Monthly 67(6):525-532 doi.org/10.1080/00029890.1960.11989541 (Pisano periods pi(3)=8, pi(9)=24). CLAIM (narrow, falsifiable): under f(b,e)=(b mod 9)+(e mod 9)*phi in Z[phi]/(9) where phi^2=phi+1 (ring of integers of Q(sqrt(5))), the QA orbit partition {Cosmos, Satellite, Singularity} coincides exactly with the prime ideal filtration {(Z[phi]/9)^*, (3)/(9)\\{0}, {0}} induced by the unique inert prime (3) over 3 in Z[phi]=O_{Q(sqrt(5))}. Five sub-claims: (C1) x^2-x-1 irreducible mod 3 so 3 is inert and Z[phi]/(9) is local with maximal ideal m=(3); (C2) |units|=72, |m|=9 (Z[phi]/(9) is local); (C3) Cosmos 72 pairs biject with (Z[phi]/9)^*; (C4) Satellite 8 pairs biject with m\\{0}, Singularity (9,9) maps to 0; (C5) orbit periods 24/8/1 match Pisano pi(9)/pi(3)/1 confirming Nikolaev Lemma 3.3 real-multiplication triple (Z[phi],[Z[phi]],Q(sqrt(5))). Exhaustive: all 81 states checked. Theorem NT: all arithmetic on integer types; no float state. Extends certs [291] (orbit period proof) and [306] (mod-24 CRT). orbit_family on (b, e, m) is not called in this cert; orbit classification is derived from ideal membership. Derived 2026-06-11."
}
