{
  "protocol_version": "QA_MAPPING_PROTOCOL_REF.v1",
  "ref_path": "qa_mapping_protocol/canonical_mapping_protocol.json",
  "ref_sha256": "e0e586f537485cf530849493e05db1b64877e918140253f0e295953fe4dfe65d",
  "scope_note": "QA Time-Reversal Focusing Cert [522]. Primary sources: (Fink, 1992) IEEE Trans. UFFC 39(5):555-566 DOI 10.1109/58.156174 (time reversal of ultrasonic fields); (Prada & Fink, 1994) Wave Motion 20:151-163 DOI 10.1016/0165-2125(94)90039-6; (Yariv, 1978) IEEE JQE 14(9):650-660 DOI 10.1109/JQE.1978.1069870; (Soffer, 1986) Opt. Lett. 11(2):118-120 DOI 10.1364/OL.11.000118. CLAIM: cert [518]'s distortion-correction operator qa_neg -- the standard involution (adjugate) = phase conjugation = TIME REVERSAL -- run IN REVERSE FOCUSES energy back onto a source through a scattering medium (Fink's time-reversal mirror), instead of correcting distortion at a receiver. A source at x0 propagates (per-element phase G(i,x0)) and scatters (medium H_i); the array records r_i=qa_add(G(i,x0),H_i,s); TIME-REVERSE each element (r_i*=qa_neg(r_i)) and re-emit toward x -> field_i(x)=qa_add(G(i,x),H_i,r_i*). The medium term appears on record and re-emit so it CANCELS: field_i(x)=qa_add(G(i,x)-G(i,x0)-s); at x=x0 every element carries the identical phase qa_neg(s) -> coherent focal peak THROUGH the medium; elsewhere the phases scatter. MECHANISM (certified deterministically, integer-only, NO external data): (FOCUS_CONSTANT) matched re-emission makes the field at the source constant across all elements = maximally coherent; (MEDIUM_CANCEL) that constant equals qa_neg(s) independent of H (verified for two distinct media); (OFF_SOURCE_SCATTER) a distinct off-source location's field is not constant; (SPECIFICITY) re-emission through a distinct medium H' destroys the focus (field at source no longer constant) -- the [518] same-medium fingerprint, now for focusing. Reference impl qa_time_reversal_focus.py (m=24, 64-element array, axiom-linter clean): refocuses exactly at the source through an arbitrary phase screen (peak coherent focus 1.000 at x0, background median ~0.49 -> focal gain >1); same-medium specificity matched peak 1.000 vs mismatched 0.244, gap +0.756. HONEST LIMIT: 1D limited-aperture geometry has finite focal resolution and moderate sidelobes (the 0.49 background); the exact refocus and the medium-specificity are the certified facts, the coherent-sum magnitude is an observer-layer readout. Distinct from cert [518] (correction at a receiver) -- same operator, reversed deployment (focusing). Checks FOCUS_CONSTANT/MEDIUM_CANCEL/OFF_SOURCE_SCATTER/SPECIFICITY/A1_RANGE/SRC/F. Builds on certs [518],[519]; phase-conjugation cluster companion [520],[521]. Author: Will Dale + Claude 2026-07-10."
}
