{
  "protocol_version": "QA_MAPPING_PROTOCOL_REF.v1",
  "ref_path": "qa_mapping_protocol/canonical_mapping_protocol.json",
  "ref_sha256": "e0e586f537485cf530849493e05db1b64877e918140253f0e295953fe4dfe65d",
  "scope_note": "QA Inhomogeneous Maxwell Recovery Cert [512]. M4 of docs/specs/QA_MAXWELL_DERIVATION_PROGRAM.md, building on [508], [509], [510], and [511]. Primary mathematical sources: Allen Hatcher, Algebraic Topology (2002), Ch. 2, ISBN 978-0-521-79540-1; Alain Bossavit, Computational Electromagnetism (1998), ISBN 978-0-12-118710-1; James Clerk Maxwell (1865), A Dynamical Theory of the Electromagnetic Field, Phil. Trans. R. Soc. 155:459-512. Claims exact finite recovery of delta(starF)=J under declared sign/unit/projection conventions. Does not derive full Maxwell, physical electromagnetism, physical fields, physical source generation, free energy, or scalar-wave-energy physics."
}
