{
  "protocol_version": "QA_MAPPING_PROTOCOL_REF.v1",
  "ref_path": "qa_mapping_protocol/canonical_mapping_protocol.json",
  "ref_sha256": "e0e586f537485cf530849493e05db1b64877e918140253f0e295953fe4dfe65d",
  "scope_note": "QA Whittaker Scalar Angular-Kernel Sampling Cert candidate family [274], standalone unregistered artifact pending hostile review. Layer 3 v1 of the Whittaker -> QA development ladder. Dependency: registered family [273] qa_whittaker_rational_direction_s2_cert_v1 supplies the exact rational S2 direction substrate D_m^(2) through the inverse_stereographic_excluding_south_pole chart. CLAIM (narrow): for m in {3,5,9}, profile_name in {const,z,z2}, and weight_rule=uniform_points, the validator recomputes exact Fraction scalar samples over [273] packets and validates the exact finite-set discrete_uniform_average. Large exact averages may be witnessed by full canonical_fraction_sha256 = sha256((num + '/' + den).encode('ascii')).hexdigest() plus numerator_digit_count and denominator_digit_count; observer floats are display only and never pass/fail. This cert does NOT prove Whittaker 1903, Whittaker's wave kernel, spherical quadrature, density, convergence, Maxwell equations, electromagnetism, scalar-potential physics, geodesy, ellipsoid physics, or any physical field reconstruction. Sources: Whittaker 1903, On the partial differential equations of mathematical physics, Math. Annalen 57:333-355, DOI 10.1007/BF01444290; registered [273] S2 cert; design draft docs/specs/QA_WHITTAKER_WAVE_KERNEL_BRIDGE_CERT_DRAFT.md. Checks WKB_1/WKB_2/WKB_3/WKB_4/WKB_5/SRC/F; 3 PASS + 7 FAIL fixtures; self-test expected ok before hostile review."
}
