{
  "protocol_version": "QA_MAPPING_PROTOCOL_REF.v1",
  "ref_path": "qa_mapping_protocol/canonical_mapping_protocol.json",
  "ref_sha256": "e0e586f537485cf530849493e05db1b64877e918140253f0e295953fe4dfe65d",
  "scope_note": "QA Pyth-3 Pitfalls of Invention cert [380]. Primary source: Iverson & Elkins (2006) Pythagorean Arithmetic Vol III Ch.11 pp.60-64. (C1) VTA 5kW threshold=5-par QN seed element; 5000%24=8=2^3. (C2) Pyramid doublings $10->$20->$40->$80->$160; 4 steps=QA tuple size; ratio=2=octave; residues=[10,20,16,8,16]. (C3) Lab $40000; 40000%24=16=Myriad; gcd(40000,24)=8. (C4) $3000/typed sheet; 3000=24*5^3 mod24=0; 3000/600=5. (C5) Searl 1948; 1948%24=4=portal 4-par; 3 stages; 3*4=12=chromatic. DOI: primary text, no external DOI."
}
